{
  "version": 1,
  "unicodeVersion": "17.0.0",
  "indexEncodings": [
    "utf16",
    "utf8"
  ],
  "cursorMode": "logical",
  "lineBreakMode": "uax14-default",
  "normalization": "none",
  "cases": [
    {
      "id": "empty",
      "tags": [
        "boundary"
      ],
      "text": "",
      "expected": {
        "graphemeCount": 0,
        "graphemes": [],
        "cursor": [
          {
            "at": {
              "utf16": 0,
              "utf8": 0
            },
            "previous": null,
            "next": null
          }
        ],
        "lineBreaks": [
          {
            "at": {
              "utf16": 0,
              "utf8": 0
            },
            "required": true
          }
        ]
      }
    },
    {
      "id": "ascii-space",
      "tags": [
        "ascii",
        "space"
      ],
      "text": "A B",
      "expected": {
        "graphemeCount": 3,
        "graphemes": [
          {
            "text": "A",
            "start": {
              "utf16": 0,
              "utf8": 0
            },
            "end": {
              "utf16": 1,
              "utf8": 1
            }
          },
          {
            "text": " ",
            "start": {
              "utf16": 1,
              "utf8": 1
            },
            "end": {
              "utf16": 2,
              "utf8": 2
            }
          },
          {
            "text": "B",
            "start": {
              "utf16": 2,
              "utf8": 2
            },
            "end": {
              "utf16": 3,
              "utf8": 3
            }
          }
        ],
        "cursor": [
          {
            "at": {
              "utf16": 0,
              "utf8": 0
            },
            "previous": null,
            "next": {
              "utf16": 1,
              "utf8": 1
            }
          },
          {
            "at": {
              "utf16": 1,
              "utf8": 1
            },
            "previous": {
              "utf16": 0,
              "utf8": 0
            },
            "next": {
              "utf16": 2,
              "utf8": 2
            }
          },
          {
            "at": {
              "utf16": 2,
              "utf8": 2
            },
            "previous": {
              "utf16": 1,
              "utf8": 1
            },
            "next": {
              "utf16": 3,
              "utf8": 3
            }
          },
          {
            "at": {
              "utf16": 3,
              "utf8": 3
            },
            "previous": {
              "utf16": 2,
              "utf8": 2
            },
            "next": null
          }
        ],
        "lineBreaks": [
          {
            "at": {
              "utf16": 2,
              "utf8": 2
            },
            "required": false
          },
          {
            "at": {
              "utf16": 3,
              "utf8": 3
            },
            "required": true
          }
        ]
      }
    },
    {
      "id": "latin-combining",
      "tags": [
        "combining"
      ],
      "text": "á̧b",
      "expected": {
        "graphemeCount": 2,
        "graphemes": [
          {
            "text": "á̧",
            "start": {
              "utf16": 0,
              "utf8": 0
            },
            "end": {
              "utf16": 3,
              "utf8": 5
            }
          },
          {
            "text": "b",
            "start": {
              "utf16": 3,
              "utf8": 5
            },
            "end": {
              "utf16": 4,
              "utf8": 6
            }
          }
        ],
        "cursor": [
          {
            "at": {
              "utf16": 0,
              "utf8": 0
            },
            "previous": null,
            "next": {
              "utf16": 3,
              "utf8": 5
            }
          },
          {
            "at": {
              "utf16": 1,
              "utf8": 1
            },
            "previous": {
              "utf16": 0,
              "utf8": 0
            },
            "next": {
              "utf16": 3,
              "utf8": 5
            }
          },
          {
            "at": {
              "utf16": 2,
              "utf8": 3
            },
            "previous": {
              "utf16": 0,
              "utf8": 0
            },
            "next": {
              "utf16": 3,
              "utf8": 5
            }
          },
          {
            "at": {
              "utf16": 3,
              "utf8": 5
            },
            "previous": {
              "utf16": 0,
              "utf8": 0
            },
            "next": {
              "utf16": 4,
              "utf8": 6
            }
          },
          {
            "at": {
              "utf16": 4,
              "utf8": 6
            },
            "previous": {
              "utf16": 3,
              "utf8": 5
            },
            "next": null
          }
        ],
        "lineBreaks": [
          {
            "at": {
              "utf16": 4,
              "utf8": 6
            },
            "required": true
          }
        ]
      }
    },
    {
      "id": "leading-combining",
      "tags": [
        "combining"
      ],
      "text": "̧́x",
      "expected": {
        "graphemeCount": 2,
        "graphemes": [
          {
            "text": "̧́",
            "start": {
              "utf16": 0,
              "utf8": 0
            },
            "end": {
              "utf16": 2,
              "utf8": 4
            }
          },
          {
            "text": "x",
            "start": {
              "utf16": 2,
              "utf8": 4
            },
            "end": {
              "utf16": 3,
              "utf8": 5
            }
          }
        ],
        "cursor": [
          {
            "at": {
              "utf16": 0,
              "utf8": 0
            },
            "previous": null,
            "next": {
              "utf16": 2,
              "utf8": 4
            }
          },
          {
            "at": {
              "utf16": 1,
              "utf8": 2
            },
            "previous": {
              "utf16": 0,
              "utf8": 0
            },
            "next": {
              "utf16": 2,
              "utf8": 4
            }
          },
          {
            "at": {
              "utf16": 2,
              "utf8": 4
            },
            "previous": {
              "utf16": 0,
              "utf8": 0
            },
            "next": {
              "utf16": 3,
              "utf8": 5
            }
          },
          {
            "at": {
              "utf16": 3,
              "utf8": 5
            },
            "previous": {
              "utf16": 2,
              "utf8": 4
            },
            "next": null
          }
        ],
        "lineBreaks": [
          {
            "at": {
              "utf16": 3,
              "utf8": 5
            },
            "required": true
          }
        ]
      }
    },
    {
      "id": "precomposed",
      "tags": [
        "normalization"
      ],
      "text": "é",
      "expected": {
        "graphemeCount": 1,
        "graphemes": [
          {
            "text": "é",
            "start": {
              "utf16": 0,
              "utf8": 0
            },
            "end": {
              "utf16": 1,
              "utf8": 2
            }
          }
        ],
        "cursor": [
          {
            "at": {
              "utf16": 0,
              "utf8": 0
            },
            "previous": null,
            "next": {
              "utf16": 1,
              "utf8": 2
            }
          },
          {
            "at": {
              "utf16": 1,
              "utf8": 2
            },
            "previous": {
              "utf16": 0,
              "utf8": 0
            },
            "next": null
          }
        ],
        "lineBreaks": [
          {
            "at": {
              "utf16": 1,
              "utf8": 2
            },
            "required": true
          }
        ]
      }
    },
    {
      "id": "decomposed",
      "tags": [
        "normalization"
      ],
      "text": "é",
      "expected": {
        "graphemeCount": 1,
        "graphemes": [
          {
            "text": "é",
            "start": {
              "utf16": 0,
              "utf8": 0
            },
            "end": {
              "utf16": 2,
              "utf8": 3
            }
          }
        ],
        "cursor": [
          {
            "at": {
              "utf16": 0,
              "utf8": 0
            },
            "previous": null,
            "next": {
              "utf16": 2,
              "utf8": 3
            }
          },
          {
            "at": {
              "utf16": 1,
              "utf8": 1
            },
            "previous": {
              "utf16": 0,
              "utf8": 0
            },
            "next": {
              "utf16": 2,
              "utf8": 3
            }
          },
          {
            "at": {
              "utf16": 2,
              "utf8": 3
            },
            "previous": {
              "utf16": 0,
              "utf8": 0
            },
            "next": null
          }
        ],
        "lineBreaks": [
          {
            "at": {
              "utf16": 2,
              "utf8": 3
            },
            "required": true
          }
        ]
      }
    },
    {
      "id": "crlf-cr-lf",
      "tags": [
        "mandatory",
        "crlf"
      ],
      "text": "A\r\nB\nC\rD",
      "expected": {
        "graphemeCount": 7,
        "graphemes": [
          {
            "text": "A",
            "start": {
              "utf16": 0,
              "utf8": 0
            },
            "end": {
              "utf16": 1,
              "utf8": 1
            }
          },
          {
            "text": "\r\n",
            "start": {
              "utf16": 1,
              "utf8": 1